{
  "schema_version": "0.1.0",
  "id": "opencode-source-event-bridge",
  "agent_id": "opencode",
  "snapshot_id": "opencode-2026-08-10-source",
  "mechanism_id": "event-stream",
  "surface": "cli",
  "statement": "OpenCode's pinned event bridge enriches published events with location and aggregate identity, assigns version and sequence metadata for durable event records, and forwards the resulting public event through the global bus.",
  "display_text": {
    "zh-CN": "固定版本的 OpenCode event bridge 会为已发布事件补充 location 与 aggregate identity，为 durable event record 分配 version 和 sequence metadata，再通过 global bus 转发公共事件。",
    "en": "OpenCode's pinned event bridge enriches events with location and aggregate identity, assigns version and sequence metadata for durable records, and forwards public events through the global bus."
  },
  "status": "reviewed",
  "evidence": [{
    "type": "source",
    "title": "OpenCode EventV2 bridge",
    "source_url": "https://github.com/anomalyco/opencode/blob/941e71dbbb94ea5b32226c2845585992dadb361f/packages/opencode/src/event-v2-bridge.ts",
    "captured_at": "2026-08-10",
    "locator": "publish and durable event append path",
    "commit": "941e71dbbb94ea5b32226c2845585992dadb361f"
  }],
  "reviewed_at": "2026-08-10",
  "reviewers": ["foundation-maintainers"],
  "notes": "The claim covers the source-visible event bridge, not retention guarantees for every deployment."
}
