{
  "schema_version": "0.1.0",
  "id": "pi-source-execution-boundary",
  "agent_id": "pi",
  "snapshot_id": "pi-2026-08-10-source",
  "mechanism_id": "execution-policy",
  "surface": "cli",
  "statement": "Pi explicitly does not provide an in-process permission system or built-in sandbox for model-invoked filesystem, process, network, or credential access; isolation must come from a container, VM, micro-VM, or other operating-system boundary.",
  "display_text": {
    "zh-CN": "Pi 明确不为模型调用的文件系统、进程、网络或凭据访问提供进程内 permission system 或内建 sandbox；隔离必须由 container、VM、micro-VM 或其他操作系统边界提供。",
    "en": "Pi explicitly does not provide an in-process permission system or built-in sandbox for model-invoked filesystem, process, network, or credential access; isolation must come from a container, VM, micro-VM, or other operating-system boundary."
  },
  "status": "reviewed",
  "evidence": [
    {
      "type": "source",
      "title": "Pi repository security boundary",
      "source_url": "https://github.com/earendil-works/pi/blob/936aff00918de1187f085f123c2812d8f2d67745/README.md",
      "captured_at": "2026-08-10",
      "locator": "Security",
      "commit": "936aff00918de1187f085f123c2812d8f2d67745"
    },
    {
      "type": "source",
      "title": "Pi coding-agent security model",
      "source_url": "https://github.com/earendil-works/pi/blob/936aff00918de1187f085f123c2812d8f2d67745/packages/coding-agent/docs/security.md",
      "captured_at": "2026-08-10",
      "locator": "Project trust; No built-in sandbox; Recommended isolation",
      "commit": "936aff00918de1187f085f123c2812d8f2d67745"
    }
  ],
  "reviewed_at": "2026-08-10",
  "reviewers": ["foundation-maintainers"],
  "notes": "Project trust guards loading of project-local configuration and extensions; the source explicitly says it is not a sandbox. Third-party extensions may add policy, but that does not change the core boundary."
}
