{
  "schema_version": "0.1.0",
  "id": "pi-source-extension-runtime",
  "agent_id": "pi",
  "snapshot_id": "pi-2026-08-10-source",
  "mechanism_id": "extension-runtime",
  "surface": "cli",
  "statement": "Pi's coding-agent layer uses an extension runner to dispatch lifecycle events and lets extensions add or replace tools, commands, UI, providers, context transforms, and compaction behavior without modifying the low-level agent loop.",
  "display_text": {
    "zh-CN": "Pi 的 coding-agent 层通过 extension runner 分派生命周期事件；extension 可以新增或替换工具、命令、UI、provider、context transform 与 compaction 行为，而无需修改底层 agent loop。",
    "en": "Pi's coding-agent layer uses an extension runner to dispatch lifecycle events and lets extensions add or replace tools, commands, UI, providers, context transforms, and compaction behavior without modifying the low-level agent loop."
  },
  "status": "reviewed",
  "evidence": [
    {
      "type": "source",
      "title": "Pi extension runner",
      "source_url": "https://github.com/earendil-works/pi/blob/936aff00918de1187f085f123c2812d8f2d67745/packages/coding-agent/src/core/extensions/runner.ts",
      "captured_at": "2026-08-10",
      "locator": "ExtensionRunner",
      "commit": "936aff00918de1187f085f123c2812d8f2d67745"
    },
    {
      "type": "source",
      "title": "Pi extension-first product contract",
      "source_url": "https://github.com/earendil-works/pi/blob/936aff00918de1187f085f123c2812d8f2d67745/packages/coding-agent/README.md",
      "captured_at": "2026-08-10",
      "locator": "Extensions; What Pi intentionally omits",
      "commit": "936aff00918de1187f085f123c2812d8f2d67745"
    }
  ],
  "reviewed_at": "2026-08-10",
  "reviewers": ["foundation-maintainers"],
  "notes": "Extensions are trusted local code in the Pi security model; extensibility is not treated as isolation."
}
