{
  "schema_version": "0.1.0",
  "id": "opencode-source-extension-runtime",
  "agent_id": "opencode",
  "snapshot_id": "opencode-2026-08-10-source",
  "mechanism_id": "extension-runtime",
  "surface": "cli",
  "statement": "OpenCode's pinned source discovers local skills, loads configured plugins, and imports MCP tools over configured transports into the same tool-resolution boundary; each extension path remains subject to its own trust and permission configuration.",
  "display_text": {
    "zh-CN": "固定版本的 OpenCode 源码会发现本地 skill、加载已配置 plugin，并把来自配置 transport 的 MCP 工具导入同一工具解析边界；每条扩展路径仍受各自的信任与权限配置约束。",
    "en": "OpenCode's pinned source discovers local skills, loads configured plugins, and imports MCP tools into the common tool-resolution boundary, with trust and permission still configuration-dependent."
  },
  "status": "reviewed",
  "evidence": [
    {
      "type": "source",
      "title": "OpenCode plugin loader",
      "source_url": "https://github.com/anomalyco/opencode/blob/941e71dbbb94ea5b32226c2845585992dadb361f/packages/opencode/src/plugin/loader.ts",
      "captured_at": "2026-08-10",
      "locator": "configured and bundled plugin loading",
      "commit": "941e71dbbb94ea5b32226c2845585992dadb361f"
    },
    {
      "type": "source",
      "title": "OpenCode MCP service",
      "source_url": "https://github.com/anomalyco/opencode/blob/941e71dbbb94ea5b32226c2845585992dadb361f/packages/opencode/src/mcp/index.ts",
      "captured_at": "2026-08-10",
      "locator": "stdio, HTTP, and SSE MCP connections and tool import",
      "commit": "941e71dbbb94ea5b32226c2845585992dadb361f"
    },
    {
      "type": "source",
      "title": "OpenCode skill discovery",
      "source_url": "https://github.com/anomalyco/opencode/blob/941e71dbbb94ea5b32226c2845585992dadb361f/packages/opencode/src/skill/discovery.ts",
      "captured_at": "2026-08-10",
      "locator": "skill directories and SKILL.md discovery",
      "commit": "941e71dbbb94ea5b32226c2845585992dadb361f"
    }
  ],
  "reviewed_at": "2026-08-10",
  "reviewers": ["foundation-maintainers"],
  "notes": "Presence of an extension mechanism is not a security endorsement of third-party code or remote servers."
}
