{
  "schema_version": "0.1.0",
  "id": "opencode-source-execution-policy",
  "agent_id": "opencode",
  "snapshot_id": "opencode-2026-08-10-source",
  "mechanism_id": "execution-policy",
  "surface": "cli",
  "statement": "OpenCode's pinned permission service evaluates wildcard rules in order with the last matching rule taking precedence, defaults unresolved requests to ask, and distinguishes deny, one-time approval, persistent approval, and rejection through explicit request/reply events.",
  "display_text": {
    "zh-CN": "固定版本的 OpenCode permission service 按顺序计算 wildcard rule，并由最后一个匹配项决定结果；未命中时默认 ask，同时通过显式 request/reply event 区分 deny、单次批准、持续批准和拒绝。",
    "en": "OpenCode's pinned permission service uses last-match wildcard rules, defaults unresolved requests to ask, and represents deny, one-time approval, persistent approval, and rejection explicitly."
  },
  "status": "reviewed",
  "evidence": [{
    "type": "source",
    "title": "OpenCode permission service",
    "source_url": "https://github.com/anomalyco/opencode/blob/941e71dbbb94ea5b32226c2845585992dadb361f/packages/opencode/src/permission/index.ts",
    "captured_at": "2026-08-10",
    "locator": "evaluate, ask, reply, and ruleset merge",
    "commit": "941e71dbbb94ea5b32226c2845585992dadb361f"
  }],
  "reviewed_at": "2026-08-10",
  "reviewers": ["foundation-maintainers"],
  "notes": "This is semantic authorization logic. It is not evidence of OS-level filesystem, process, or network isolation."
}
